{
  "schema_version": 1,
  "cache_key": "sha256:aaaaaaaaaaaaaaaaaaaaaaaaaaaaaaaaaaaaaaaaaaaaaaaaaaaaaaaaaaaaaaaa",
  "dataset_id": "SHFE.AO2609.5m",
  "data_revision": "sha256:bbbbbbbbbbbbbbbbbbbbbbbbbbbbbbbbbbbbbbbbbbbbbbbbbbbbbbbbbbbbbbbb",
  "strategy": {
    "kind": "chan",
    "algorithm_id": "chan_engineering",
    "algorithm_version": "1.0.0",
    "source_hash": "sha256:cccccccccccccccccccccccccccccccccccccccccccccccccccccccccccccccc"
  },
  "parameters": {"fractal_left": 2, "fractal_right": 2},
  "range": {"from_bar_index": 14000, "to_bar_index": 17016, "warmup_from_bar_index": 0},
  "engine_version": "0.1.0",
  "event_count": 4200,
  "events_sha256": "sha256:dddddddddddddddddddddddddddddddddddddddddddddddddddddddddddddddd",
  "created_at": "2026-08-01T00:00:00Z"
}
